{
    "reportName": "Sales Performance Report",
    "targetAudience": "CEO and Sales Unit Managers",
    "observationPeriod": "Monthly, with a focus on reporting weekly insights",
    "summary": "I need the performance overview for the sales departments based on weekly performance. Focus on outliers too"
}