{
    "reportName": "Sales Performance Report",
    "targetAudience": "Sales Managers and CEO",
    "observationPeriod": "Last month, focussing on last week",
    "summary": "I need a report as described, with the key insights being the performance per sales region, sales department and on a weekly basis"
}